{
  "taskID": 123,
  "aiAgentFlowRunID": 456,
  "aiAgentTaskExecutionID": 789,
  "agentType": "codex",
  "finalOutput": "<LAVIYA_RESULT>{\"contractVersion\":\"1.0\",\"outputType\":\"implementation_result\",\"agentReportedStatus\":\"completed\",\"payload\":{\"summary\":\"Implemented and tested the requested change.\",\"changedFiles\":[{\"path\":\"src/example.ts\",\"change\":\"Implemented validation.\"}],\"tests\":{\"executed\":true,\"passed\":true,\"details\":\"All tests passed.\"},\"remainingIssues\":[]},\"attachments\":[],\"agentNotes\":[]}</LAVIYA_RESULT>"
}
